{
  "run_id": "demo_B2",
  "task_id": "t_c02",
  "decision": "override",
  "confidence": "low",
  "rationale": [
    "System proposed category 'None'. Human overrode to 'Category_A'.",
    "No rationale provided."
  ],
  "notes": "Override for demo: boundary condition adjudication; accept accountability for reclassification."
}