{
  "run_id": "demo_C",
  "task_id": "t_c02",
  "decision": "abstain",
  "confidence": "low",
  "rationale": [
    "Swarm redundancy (3 independent calls) resulted in unanimous abstention (all candidates None).",
    "System escalated by abstaining; human accepted abstention as final."
  ],
  "notes": "accept the abstention"
}